{
  "$schema": "../schema.json",
  "rulesetVersion": "1.0",
  "statutoryRegime": "ITA_1961",
  "assessmentYear": "2026-27",
  "financialYear": "2025-26",
  "formType": "ITR-1",
  "formName": "Sahaj",

  "eligibilityCriteria": {
    "maxTotalIncome": 5000000,
    "maxAgriculturalIncome": 5000,
    "permittedHouseProperties": 2,
    "permittedIncomeSources": [
      "Salary / Pension (Section 192)",
      "Up to Two House Properties (AY 2026-27 statutory amendment)",
      "Other Sources (Interest u/s 194A/193, Dividend u/s 194K, Family Pension)",
      "Long-Term Capital Gains under Section 112A up to ₹1,25,000"
    ],
    "capitalGains112aExemptionLimit": 125000
  },

  "disqualifiers": [
    {
      "id": "income_limit_50l",
      "description": "Total taxable income exceeds ₹50,00,000 (₹50 Lakhs)",
      "statutoryReference": "Rule 12(1)(a)",
      "elevatesTo": "ITR-2"
    },
    {
      "id": "multiple_house_properties",
      "description": "Income or ownership of more than two house properties",
      "statutoryReference": "Rule 12(1)(a) (AY 2026-27 amendment)",
      "elevatesTo": "ITR-2"
    },
    {
      "id": "capital_gains_over_limit",
      "description": "Section 112A LTCG exceeds ₹1,25,000 or any STCG / other capital gains present",
      "statutoryReference": "Section 112A / Sections 45-55A (Schedule CG)",
      "elevatesTo": "ITR-2"
    },
    {
      "id": "company_directorship",
      "description": "Directorship held in any Indian or foreign company",
      "statutoryReference": "Part A-General Disclosures",
      "elevatesTo": "ITR-2"
    },
    {
      "id": "unlisted_equity_shares",
      "description": "Held unlisted equity shares at any time during the financial year",
      "statutoryReference": "Part A-General Disclosures",
      "elevatesTo": "ITR-2"
    },
    {
      "id": "foreign_assets_or_income",
      "description": "Holding foreign bank accounts, overseas assets, or signing authority abroad",
      "statutoryReference": "Schedule FA / Schedule FSI",
      "elevatesTo": "ITR-2"
    },
    {
      "id": "agricultural_income_limit",
      "description": "Net agricultural income exceeds ₹5,000",
      "statutoryReference": "Section 10(1)",
      "elevatesTo": "ITR-2"
    },
    {
      "id": "brought_forward_losses",
      "description": "Brought forward or carry forward loss under any head",
      "statutoryReference": "Schedule CFL",
      "elevatesTo": "ITR-2"
    },
    {
      "id": "business_profession_income",
      "description": "Profits and gains of business or profession",
      "statutoryReference": "Section 28-44DB (Schedule PGBP)",
      "elevatesTo": "ITR-3"
    },
    {
      "id": "virtual_digital_assets",
      "description": "Income from transfer of Virtual Digital Assets (Crypto / VDA)",
      "statutoryReference": "Section 115BBH (Schedule VDA)",
      "elevatesTo": "ITR-2"
    }
  ],

  "externalChecklist": [
    {
      "id": "income_limit_50l",
      "question": "Does your total taxable income exceed ₹50,00,000 (₹50 Lakhs)?",
      "impactIfYes": "Requires ITR-2 (ITR-1 is capped at ₹50 Lakhs total income)"
    },
    {
      "id": "multiple_house_properties",
      "question": "Do you own or earn rental income from more than two house properties?",
      "impactIfYes": "Requires ITR-2 (ITR-1 permits up to two house properties for AY 2026-27)"
    },
    {
      "id": "company_directorship",
      "question": "Were you a Director in an Indian or foreign company during the financial year?",
      "impactIfYes": "Requires ITR-2 (Director details mandatory in Part A-General)"
    },
    {
      "id": "unlisted_equity_shares",
      "question": "Did you hold unlisted equity shares at any time during the financial year?",
      "impactIfYes": "Requires ITR-2 (Unlisted equity disclosures required)"
    },
    {
      "id": "foreign_assets_or_income",
      "question": "Do you hold foreign bank accounts, foreign stocks (e.g. RSUs/ESPP), or signing authority abroad?",
      "impactIfYes": "Requires ITR-2 (Schedule FA & FSI disclosures mandatory)"
    },
    {
      "id": "agricultural_income_limit",
      "question": "Does your net agricultural income exceed ₹5,000?",
      "impactIfYes": "Requires ITR-2 (ITR-1 limits agricultural income to ₹5,000)"
    },
    {
      "id": "brought_forward_losses",
      "question": "Do you have brought forward or carry forward losses under any income head?",
      "impactIfYes": "Requires ITR-2 (Schedule CFL mandatory)"
    }
  ],

  "taxComputation": {
    "newRegime": {
      "section": "115BAC",
      "isDefault": true,
      "standardDeductionSalary": 75000,
      "slabs": [
        { "from": 0, "to": 400000, "rate": 0 },
        { "from": 400000, "to": 800000, "rate": 0.05 },
        { "from": 800000, "to": 1200000, "rate": 0.10 },
        { "from": 1200000, "to": 1600000, "rate": 0.15 },
        { "from": 1600000, "to": 2000000, "rate": 0.20 },
        { "from": 2000000, "to": 2400000, "rate": 0.25 },
        { "from": 2400000, "to": null, "rate": 0.30 }
      ],
      "rebate87A": {
        "maxIncomeThreshold": 1200000,
        "maxRebateAmount": 60000,
        "marginalReliefEligible": true
      },
      "cessPercentage": 0.04
    },
    "oldRegime": {
      "standardDeductionSalary": 50000,
      "slabs": [
        { "from": 0, "to": 250000, "rate": 0 },
        { "from": 250000, "to": 500000, "rate": 0.05 },
        { "from": 500000, "to": 1000000, "rate": 0.20 },
        { "from": 1000000, "to": null, "rate": 0.30 }
      ],
      "rebate87A": {
        "maxIncomeThreshold": 500000,
        "maxRebateAmount": 12500
      },
      "cessPercentage": 0.04,
      "allowedDeductions": [
        "Section 80C (PPF, ELSS, EPF, LIC - Max ₹1.5L)",
        "Section 80D (Health Insurance - Max ₹75k)",
        "Section 80CCD(1B) (NPS Additional - Max ₹50k)",
        "Section 24(b) (Home Loan Interest - Max ₹2.0L)",
        "Section 80TTA (Savings Interest - Max ₹10k)"
      ]
    }
  }
}
